Index,Category,Condition,Paragraphe,Adapt_Poso,Anticholinergiques selon l'ANSM,Charge anticholinergique centrale,Charge anticholinergique périphérique,Torsadogène,Dépresseur_SNC,Médicam inapprop,Hypok,HyperK,Bradycardisant,HypoT_Ortho,Pro_convul
Omeprazole [MOPRAL],Contrôle des intéractions médicamenteuses :,Co-prescription clopidogrel :,Attention ! L’oméprazole inhibe le métabolisme hépatique (CYP 2C19) du clopidogrel nécessaire à son activation (pro-drogue). Risque d’inefficacité médicamenteuse.,(À TRAITER),0,0,0,0,0,1,0,0,0,0,0
Optive fusion,,Par défaut :,Prise en charge de la sécheresse oculaire. A pourusivre si besoin.,(À TRAITER),0,0,0,0,0,0,0,0,0,0,0
Indacaterol [ONBREZ BREEZHALER],,Par défaut :,Traitement bronchodilatateur continu de l'obstruction des voies respiratoires chez les patients adultes atteints de bronchopneumopathie chronique obstructive (BPCO).,(À TRAITER),0,0,0,0,0,0,0,0,0,0,0
Oxazepam [SERESTA],Contrôle des indications :,Prise uniquement au coucher :,"Prise en charge de l’insomnie. Médicament à l’origine de troubles cognitifs, confusionnels et de chutes. Rappel : Le traitement médicamenteux de l’insomnie doit être de courte durée (comprenant la phase d’arrêt progressif) afin d’éviter un risque d’abus et de dépendance qui augmente avec la durée du traitement.",(À TRAITER),0,0,0,0,1,0,0,0,0,0,0
Oxazepam [SERESTA],Contrôle des indications :,Prises réparties dans la journée sans antécédent d’anxiété :,"Prise en charge symptomatique des manifestations anxieuses sévères et/ou invalidantes. Pas d’ATCD dans le dossier médical. Médicament à l’origine de troubles cognitifs, confusionnels et de chutes. Privilégier la posologie minimale efficace. Attention au risque d’abus et de dépendance, ainsi qu’à la tolérance pharmacologique qui nécessite d’augmenter toujours plus les doses afin de retrouver un effet anxiolytique.",(À TRAITER),0,0,0,0,1,0,0,0,0,0,0
Oxazepam [SERESTA],Contrôle des indications :,Antécédent de sevrage alcoolique :,Prévention et traitement du delirium tremens et des autres manifestations du sevrage alcoolique. A reprendre.,(À TRAITER),0,0,0,0,1,0,0,0,0,0,0
Oxazepam [SERESTA],Contrôle des posologies :,Poso > 3 mg/jour :,"Prise en charge symptomatique des manifestations anxieuses sévères et/ou invalidantes. Pas d’ATCD dans le dossier médical. Pas de preuve d’efficacité supérieure aux doses supérieurs à 3 mg/j avec majoration des troubles cognitifs et confusionnels et majoration du risque de chute. Privilégier la posologie minimale efficace. Attention au risque d’abus et de dépendance, ainsi qu’à la tolérance pharmacologique qui nécessite d’augmenter toujours plus les doses afin de retrouver un effet anxiolytique.",(À TRAITER),0,0,0,0,1,0,0,0,0,0,0
Oxazepam [SERESTA],Contrôle des contre-indications et précautions d'emploi :,Prises réparties dans la journée et antécédent de troubles cognitifs :,"Prise en charge symptomatique des manifestations anxieuses sévères et/ou invalidantes. Patient aux antécédents de troubles cognitifs : Risque d’aggravation des troubles cognitifs et/ou apparition d’un syndrome confusionnel par la benzodiazépine avec risque de chutes. Préconiser un arrêt progressif en privilégiant, en cas de nécessité d’une approche pharmacologique, pour une anxiété chronique (évoluant depuis au moins 6 mois) : un traitement de fond par antidépresseurs (Sertraline ou Miansérine).",(À TRAITER),0,0,0,0,1,0,0,0,0,0,0
Oxazepam [SERESTA],Contrôle des contre-indications et précautions d'emploi :,Antécédent de syndrome d'apnée obstructif du sommeil (SAOS) et prise le soir ou au couché :,Attention ! Les benzodiazépines sont contre-indiqués chez les patients aux antécédents de syndrome d'apnée obstructif du sommeil (SAOS). Préconiser un arrêt PROGRESSIF de la benzodiazépine.,(À TRAITER),0,0,0,0,1,0,0,0,0,0,0
Oxazepam [SERESTA],Contrôle des contre-indications et précautions d'emploi :,Antécédent de myasthénie :,Attention ! Avec leur composante myorelaxante les benzodiazépines sont contre-indiqués chez les patients (notamment les personnes âgées) aux antécédents de myasthénie. Préconiser un arrêt PROGRESSIF de la benzodiazépine.,(À TRAITER),0,0,0,0,1,0,0,0,0,0,0
Oxazepam [SERESTA],Contrôle des contre-indications et précautions d'emploi :,Patient admis aux urgences pour insuffisance respiratoire :,Attention ! Médicament aggravant l’insuffisance respiratoire.,(À TRAITER),0,0,0,0,1,0,0,0,0,,
Oxazepam [SERESTA],Contrôle des intéractions médicamenteuses :,Utilisation concomitante d’une autre benzodiazépine (anxio ou hypno) au même moment de la journée :,"Potentialisation des effets indésirables (troubles cognitifs, syndrome confusionnel, troubles de la vigilance, chutes) sans augmentation de l’efficacité.",(À TRAITER),0,0,0,0,1,0,0,0,0,,
Oxcarbazepine [TRILEPTAL],,(À TRAITER),(À TRAITER),(À TRAITER),0,2,2,0,0,0,0,0,0,0,0
Oxetorone [NORCETONE],,(À TRAITER),(À TRAITER),(À TRAITER),0,0,0,0,1,0,0,0,0,0,0
Oxomemazine [TOPLEXIL],,Par défaut :,"Médicament pourvoyeur d’effets anticholinergiques, à l’origine d’hypotension orthostatique, et, par conséquent, de chutes avec une efficacité antitussive discutable.",(À TRAITER),1,3,3,0,1,1,0,0,0,1,1
Oxomemazine [TOPLEXIL],,A rajouter si patient épileptique :,Attention ! Médicament abaissant le seuil épileptogène. Réévaluer la balance bénéfice/risque en cas d'apparition ou d'augmentation des crises épileptiques malgré le traitement de fond. ,(À TRAITER),1,3,3,0,1,1,0,0,0,1,1
Oxybutynine [DITROPAN],,Antécédent de fuite urinaire :,Prise en charge symptomatique de l'incontinence urinaire. Médicament pourvoyeur d’effets anticholinergiques notamment centraux. La confusion est un effet indésirable fréquent de l’oxybutynine. Privilégier la solifénacine qui n’a pas d’effet anticholinergique central.,(À TRAITER),1,3,3,0,0,1,0,0,0,0,0
Oxycodone [OXYCONTIN],Contrôle des contre-indications et précautions d'emploi :,AVEC co-prescription de laxatif : ,Prise en charge des douleurs importantes. A reprendre si besoin.,(À TRAITER),0,0,0,0,1,0,0,0,0,0,0
Oxycodone [OXYCONTIN],Contrôle des contre-indications et précautions d'emploi :,SANS co-prescription de laxatif : ,Prise en charge des douleurs importantes. Attention ! Médicament à risque de constipation voir fécalome chez le sujet âgé. Préconiser une intauration de laxatif osmotique (MACROGOL ou LACTULOSE) en concomitance de l'opioïde de palier 3.,(À TRAITER),0,0,0,0,1,0,0,0,0,0,0
Oxycodone [OXYCONTIN],Contrôle des contre-indications et précautions d'emploi :,Patient admis aux urgences pour insuffisance respiratoire :,Attention ! Médicament aggravant l’insuffisance respiratoire.,(À TRAITER),0,0,0,0,1,0,0,0,0,0,0
Oxycodone [OXYCONTIN],Contrôle des intéractions médicamenteuses :,Co-prescription de benzodiazépine : ,Attention à l'effet synergique sédatif et dépresseur respiratoire des opioïdes en concomitance des benzodiazépines.,(À TRAITER),0,0,0,0,1,0,0,0,0,0,0
Paliperidone [XEPLION / TREVICTA],,(À TRAITER),(À TRAITER),(À TRAITER),0,0,0,0,1,0,0,0,0,1,0
Pantoprazole [EUPANTOL / INIPOMP],Contrôle des indications :,Sans antécédent AVEC prescription de Aspirine faible dose :,"Pas d’indication aux IPP au long cours (RGO avec œsophagite, corticothérapie avec épigastralgie, hernie hiatale...) dans le dossier médical. Pour rappel, le Kardegic n’est pas considéré comme AINS à la posologie AAP. Le traitement au long cours des IPP est à risque d’effets indésirables importants (ostéoporose,  hypoMg, diarrhée associée à C. difficile, carence en vit B12, infections pulmonaires…). Préconiser un arrêt progressif sous couvert de GAVISCON afin de traiter un éventuel effet rebond.",(À TRAITER),0,0,0,0,0,1,0,0,0,0,0
Pantoprazole [EUPANTOL / INIPOMP],Contrôle des indications :,Sans antécédent AVEC prescription d’un AAP en monothérapie sauf Aspirine faible dose :,"Pas d’indication aux IPP au long cours (RGO avec œsophagite, corticothérapie avec épigastralgie, hernie hiatale...) dans le dossier médical. Pour rappel, la monothérapie antiaggrégant plaquettaire n’est pas une indication à l’instauration d’un IPP. Le traitement au long cours des IPP est à risque d’effets indésirables importants (ostéoporose,  hypoMg, diarrhée associée à C. difficile, carence en vit B12, infections pulmonaires…). Préconiser un arrêt progressif sous couvert de GAVISCON afin de traiter un éventuel effet rebond.",(À TRAITER),0,0,0,0,0,1,0,0,0,0,0
Pantoprazole [EUPANTOL / INIPOMP],Contrôle des indications :,Sans antécédent SANS prescription d'antiaggrégant plaquettaire :,"Pas d’indication aux IPP au long cours (RGO avec œsophagite, corticothérapie avec épigastralgie, hernie hiatale...) dans le dossier médical. Le traitement au long cours des IPP est à risque d’effets indésirables importants (ostéoporose,  hypoMg, diarrhée associée à C. difficile, carence en vit B12, infections pulmonaires…). Préconiser un arrêt progressif sous couvert de GAVISCON afin de traiter un éventuel effet rebond.",(À TRAITER),0,0,0,0,0,1,0,0,0,0,0
Pantoprazole [EUPANTOL / INIPOMP],Contrôle des indications :,Avec antécédent de RGO sans œsophagite :,"Dans le RGO sans œsophagite, les IPP sont indiqués uniquement pour 4 semaines max. Le traitement au long cours des IPP est à risque d’effets indésirables importants (ostéoporose,  hypoMg, diarrhée associée à C. difficile, carence en vit B12, infections pulmonaires…). Préconiser un arrêt progressif sous couvert de GAVISCON afin de traiter un éventuel effet rebond.",(À TRAITER),0,0,0,0,0,1,0,0,0,0,0
Pantoprazole [EUPANTOL / INIPOMP],Contrôle des indications :,"Avec indication au long cours (Prévention RGO en présence d’œsophagite, Bithérapie antiaggrégant plaquettaire, Traitement d’entretien de l’ulcère duodénal, Hernie Hiatal, Syndrome de Zollinger-Ellison, Corticothérapie au long cours avec épigastralgie) :","[Prévention de RGO en présence d’œsophagite./Traitement d’entretien de l’ulcère duodénal. / Prise en charge du syndrome de Zollinger-Ellison./ Traitement des épigastralgies lors d’un traitement par corticothérapie au long cours.] A reprendre. Attention prendre en compte et anticiper les effets indésirables importants des IPP au long cours : ostéoporose, hypomagnésémie, diarrhée associée à C. difficile, carence en vitamine B12, infections pulmonaires…",(À TRAITER),0,0,0,0,0,1,0,0,0,0,0
Pantoprazole [EUPANTOL / INIPOMP],Contrôle des intéractions médicamenteuses :,Co-prescription méthotrexate > 20 mg/semaine :,Attention ! Risque d’augmentation de la toxicité du méthotrexate par diminution de son élimination rénale par le pantoprazole.,(À TRAITER),0,0,0,0,0,1,0,0,0,0,0
Paracetamol [DOLIPRANE / DAFALGAN / EFFERALGAN],Contrôle des posologies :,Poso > 3g/j :,Prise en charge de la douleur. Privilégier une posologie maximale de 3g par jour chez le sujet âgé de plus de 50 kg.,(À TRAITER),0,0,0,0,0,0,0,0,0,0,0
Paracetamol [DOLIPRANE / DAFALGAN / EFFERALGAN],Contrôle des posologies :,Poso =  3g/j chez patient > 50kg :,Prise en charge de la douleur. A reprendre si besoin. ,(À TRAITER),0,0,0,0,0,0,0,0,0,0,0
Paracetamol [DOLIPRANE / DAFALGAN / EFFERALGAN],Contrôle des posologies :,Poso =  3g/j chez patient < 50kg :,Prise en charge de la douleur. Privilégier une posologie maximale de 500 mg 4 fois par jour chez le sujet âgé de moins de 50 kg.,(À TRAITER),0,0,0,0,0,0,0,0,0,0,0
Paracetamol [DOLIPRANE / DAFALGAN / EFFERALGAN],Contrôle des contre-indications et précautions d'emploi :,Patient avec antécédent d'alcoolisme non sevré :,Prise en charge de la douleur. Attention ! Risque plus grand d’hépatotoxicité chez le sujet alcoolique chronique par induction (stabilisation) du CYP 2E1 par l’éthanol menant à la formation quantitativement plus élevée du métabolite hépatotoxique du paracétamol (NAPQI). Revoir la prise en charge.,(À TRAITER),0,0,0,0,0,0,0,0,0,0,0
Paroxetine [DEROXAT / DIVARIUS],Contrôle des indications :,Aucun antécédent retrouvé dans le dossier médical :,"Prise en charge d’un épisode dépressif majeur caractérisé (selon le DSM-V), de TOC, de phobie sociale, d’un trouble anxieux généralisé ou de trouble panique. Pas d’antécédent dans le dossier médical. Médicament hyponatrémiant (à surveiller chez le sujet âgé) et anticholinergique avec effets périphériques et centraux (à risque de syndrome confusionnel). Privilégier un antidépresseur dépourvu d'effet anticholinergique (Sertraline ou Miansérine).",Réglé,0,3,2,0,0,0,0,0,0,0,1
Paroxetine [DEROXAT / DIVARIUS],Contrôle des indications :,"Antécédent d'épisode dépressif majeur, de TOC, de Phobie Sociale, de Trouble Panique ou de Trouble Anxieux Généralisé : ",Prise en charge [d’un épisode dépressif majeur caractérisé / de Troubles Obsessionnels Compulsifs (TOC) / de Phobie Sociale / d’un Trouble Anxieux Généralisé / du Trouble Panique avec ou sans agoraphobie]. Médicament hyponatrémiant (à surveiller chez le sujet âgé) et anticholinergique avec effets périphériques et centraux (à risque de syndrome confusionnel). Privilégier un antidépresseur dépourvu d'effet anticholinergique (Sertraline ou Miansérine).,Réglé,0,3,2,0,0,0,0,0,0,0,1
Paroxetine [DEROXAT / DIVARIUS],Contrôle des posologies :,Poso > 40 mg/j :,,Réglé,0,3,2,0,0,0,0,0,0,0,
Paroxetine [DEROXAT / DIVARIUS],Contrôle des contre-indications et précautions d'emploi :,Antécédent d'épilepsie :,Attention ! Médicament abaissant le seuil épileptogène. Réévaluer la balance bénéfice/risque en cas d'apparition ou d'augmentation des crises épileptiques malgré le traitement de fond. ,Réglé,0,3,2,0,0,0,0,0,0,0,1
Paroxetine [DEROXAT / DIVARIUS],Contrôle des intéractions médicamenteuses :,Co-prescription de tramadol/lithium/millepertuis :,"Attention, le risque de syndrome sérotoninergique (rare mais grave) est majoré avec le [tramadol/lithium/millepertuis]. Préconiser l’arrêt du [tramadol/millepertuis].",Réglé,0,3,2,0,0,0,0,0,0,0,1
Palmier de Floride [PERMIXON],,Antécédent d’HBP :,Prise en charge des troubles mictionnels modérés liés à l'hypertrophie bénigne de la prostate. A reprendre. ,(À TRAITER),0,0,0,0,0,0,0,0,0,0,0
Perindopril [COVERSYL],Contrôle des indications :,"Antécédent d’HTA (seul ou en association fixe COVERAM, LIPERCOSYL) :",Prise en charge de l’HTA. Attention médicament hyperkaliémiant. Rappel objectif tensionnel : 140/90 mmHg voire 150/90 mmHg pour perfusion cérébrale. A reprendre.,(À TRAITER),0,0,0,0,0,0,0,1,0,0,0
Perindopril [COVERSYL],Contrôle des indications :,Antécédent d’insuffisance cardiaque :,Prise en charge de l’insuffisance cardiaque. Attention médicament hyperkaliémiant.  A reprendre.,(À TRAITER),0,0,0,0,0,0,0,1,0,0,0
Perindopril [COVERSYL],Contrôle des indications :,Antécédent d’infarctus du myocarde :,Traitement médicamenteux post-infarctus (Protocole BASIC). Attention médicament hyperkaliémiant.  A reprendre.,(À TRAITER),0,0,0,0,0,0,0,1,0,0,0
Perindopril [COVERSYL],Contrôle des intéractions médicamenteuses :,Co-prescription de Lithium :,La vasodilatation de l’artériole rénale efférente par l’énalapril est responsable d’une insuffisance rénale pouvant augmenter les concentrations de lithium et mener à un surdosage faisant ainsi l’objet d’une ASSOCIATION DECONSEILLEE entre l’énalapril et le lithium (Thésaurus de l’ANSM 2020).,(À TRAITER),0,0,0,0,0,0,0,1,0,0,0
Perindopril [COVERSYL],Contrôle des intéractions médicamenteuses :,"Co-prescription de AINS, Colchicine et Digoxine :",La vasodilatation de l’artériole rénale efférente par l’énalapril est responsable d’une insuffisance rénale nécessitant une précaution d’emploi avec [la digoxine/la colchicine/les AINS].,(À TRAITER),0,0,0,0,0,0,0,1,0,0,0
Perindopril [COVERSYL],Contrôle des intéractions médicamenteuses :,"Co-prescription de Gliptines, Inhibiteurs de mTOR ou Racécadotril :",Attention ! L’association entre l’énalapril et [Gliptines/Inhibiteurs de mTOR/Racécadotril] est déconseillée (Thésaurus de l’ANSM 2020) et à risque de majoration de la survenue d’une réaction vasculaire à type d’angio-oedème de la face et du cou pouvant être fatale. Il convient de rechercher des antécédents de survenue de cet effet et de mesurer la nécessité de cette association.,(À TRAITER),0,0,0,0,0,0,0,1,0,0,0
Perindopril [COVERSYL],Contrôle des intéractions médicamenteuses :,Co-prescription d’un ARA II :,"Attention ! Co-prescription d’un autre médicament inhibant le système rénine-angiotensine : [Nom du médicament]. Risque d’insuffisance rénale et d’hyperkaliémie, d’hypotension et de syncopes, sans effet bénéfique prouvé sur la réduction de la mortalité cardio‐vasculaire. ",(À TRAITER),0,0,0,0,0,0,0,1,0,0,0
Phenobarbital [GARDENAL],,(À TRAITER),(À TRAITER),(À TRAITER),0,0,0,0,1,0,0,0,0,0,0
Phloroglucinol [SPASFON],,Par défaut :,"Traitement symptomatique des douleurs aiguës des voies urinaires, des troubles du transit et/ou de l’inconfort intestinal liés aux troubles fonctionnels intestinaux.",(À TRAITER),0,0,0,0,0,0,0,0,0,0,0
Pinaverium [DICETEL],,Par défaut :,"Traitement symptomatique des douleurs, des troubles du transit et de l’inconfort intestinal liés aux troubles fonctionnels intestinaux.",(À TRAITER),0,0,0,0,0,0,0,0,0,0,0
Pimozide [ORAP],,(À TRAITER),(À TRAITER),(À TRAITER),0,2,2,1,1,1,0,0,0,1,1
Pimozide [ORAP],,A rajouter si patient épileptique :,Attention ! Médicament abaissant le seuil épileptogène. Réévaluer la balance bénéfice/risque en cas d'apparition ou d'augmentation des crises épileptiques malgré le traitement de fond. ,(À TRAITER),0,2,2,1,1,1,0,0,0,1,1
Pipamperone [DIPIPERON],,(À TRAITER),(À TRAITER),(À TRAITER),0,0,0,0,1,0,0,0,0,1,1
Pipamperone [DIPIPERON],,A rajouter si patient épileptique :,Attention ! Médicament abaissant le seuil épileptogène. Réévaluer la balance bénéfice/risque en cas d'apparition ou d'augmentation des crises épileptiques malgré le traitement de fond. ,(À TRAITER),0,0,0,0,1,0,0,0,0,1,1
Piribedil [TRIVASTAL],,Antécédent de Parkinson :,"Prise en charge de la maladie de Parkinson. Attention, médicament à l’origine d’endormissement brusque et d’hypotension orthostatique, et par conséquent, de chute. A prendre en compte. A poursuivre.",(À TRAITER),0,0,0,0,0,0,0,0,0,1,0
Pizotifene [SANMIGRAN],,(À TRAITER),(À TRAITER),(À TRAITER),1,0,0,0,1,0,0,0,0,0,0
Polystyrène sulfonate de sodium [KAYEXALATE],,Par défaut :,Prise en charge de l’hyperkaliémie.,(À TRAITER),0,0,0,0,0,0,0,0,0,0,0
Pramipexol [SIFROL],Contrôle des indications :,Antécédent de Parkinson :,"Prise en charge de la maladie de Parkinson. Attention, médicament à l’origine d’endormissement brusque et d’hypotension orthostatique, et par conséquent, de chute. A prendre en compte. A poursuivre.",(À TRAITER),0,0,0,0,0,0,0,0,0,1,0
Pramipexol [SIFROL],Contrôle des indications :,Prise uniquement le soir :,"Prise en charge symptomatique du syndrome idiopathique des jambes sans repos modéré à sévère. Attention, médicament à l’origine d’hypotension orthostatique, et par conséquent, de chute. A prendre en compte. A poursuivre si besoin.",(À TRAITER),0,0,0,0,0,0,0,0,0,1,0
Prasugrel [EFIENT],,Par défaut :,Médicament à risque accru de survenue d’un saignement chez les personnes âgées ≥ 75 ans et de poids inférieur à 60 kg. Privilégier l’aspirine (clopidogrel si intolérance ou contre-indication).,(À TRAITER),0,0,0,0,0,1,0,0,0,0,0
Pravastatine [VASTEN],Contrôle des indications :,Prévention primaire (dyslipidémie) chez le plus de 80 ans :,"Absence de preuve formelle de l’efficacité des statines sur la réduction de la mortalité toutes causes chez les sujets âgés de plus de 80 ans à faible risque cardiovasculaire en prévention primaire. Effets indésirables musculo‐squelettiques (myalgies, myopathies, rhabdomyolyse), risque de diabète et d’atteintes hépatiques. Privilégier l’abstention thérapeutique.",(À TRAITER),0,0,0,0,0,0,0,0,0,0,0
Pravastatine [VASTEN],Contrôle des indications :,"Antécédent de cardiopathie ischémique (SCA ST+ (=Infarctus du myocarde) ou ST-(=Angor instable), SCC (=Angor stable), AIT, AVC ischémique, AOMI) :","Prévention, secondaire à une pathologie artérielle ischémique confirmée [indiquer laquelle + si possible la date], des complications cardiovasculaires et/ou cérébrovasculaires liées à l'athérosclérose. A reprendre.",(À TRAITER),0,0,0,0,0,0,0,0,0,0,0
Prazepam [LYSANXIA],Contrôle des indications :,Prise uniquement au coucher :,"Benzodiazépine à demi-vie longue. Prise en charge de l’insomnie. Médicament à l’origine de troubles confusionnels et de chutes. Préconiser un arrêt progressif en privilégiant, à l'avenir, des benzodiazépines à demi-vie courte (ex : OXAZEPAM) à posologie minimale efficace.  Rappel : Le traitement médicamenteux de l’insomnie doit être de courte durée (comprenant la phase d’arrêt progressif) afin d’éviter un risque d’abus et de dépendance qui augmente avec la durée du traitement.",(À TRAITER),0,0,0,0,1,1,0,0,0,0,0
Prazepam [LYSANXIA],Contrôle des indications :,Prises réparties dans la journée SANS antécédent de troubles cognitifs :,"Benzodiazépine à demi-vie longue. Prise en charge des manifestations anxieuses sévères et/ou invalidantes. Médicament à l’origine de troubles confusionnels et de chute. Préconiser un arrêt progressif en privilégiant des BZD à demi-vie courte (ex : OXAZEPAM) à posologie minimale efficace. Attention au risque d’abus et de dépendance, ainsi qu’à la tolérance pharmacologique qui nécessite d’augmenter toujours plus les doses afin de retrouver un effet anxiolytique. ",(À TRAITER),0,0,0,0,1,1,0,0,0,0,0
Prazepam [LYSANXIA],Contrôle des indications :,Antécédent de sevrage alcoolique :,Prévention et traitement du delirium tremens et des autres manifestations du sevrage alcoolique. Privilégier des benzodiazépines à demi-vie courte chez la personne âgée (ex : Alprazolam).,(À TRAITER),0,0,0,0,1,1,0,0,0,0,0
Prazepam [LYSANXIA],Contrôle des contre-indications et précautions d'emploi :,Prises réparties dans la journée AVEC antécédent de troubles cognitifs :,"Prise en charge symptomatique des manifestations anxieuses sévères et/ou invalidantes. Patient aux antécédents de troubles cognitifs : Risque d’aggravation des troubles cognitifs et/ou apparition d’un syndrome confusionnel par la benzodiazépine avec risque de chute. Préconiser un arrêt progressif en privilégiant, en cas de nécessité d’une approche pharmacologique et pour une anxiété chronique (évoluant depuis au moins 6 mois) : un traitement de fond par antidépresseur (ex : Sertraline).",(À TRAITER),0,0,0,0,1,1,0,0,0,0,0
Prazepam [LYSANXIA],Contrôle des contre-indications et précautions d'emploi :,Patient admis aux urgences pour insuffisance respiratoire :,Attention ! Médicament aggravant l’insuffisance respiratoire.,(À TRAITER),0,0,0,0,1,1,0,0,0,0,0
Prazepam [LYSANXIA],Contrôle des contre-indications et précautions d'emploi :,Antécédent de syndrome d'apnée obstructif du sommeil (SAOS) et prise le soir ou au couché :,Attention ! Les benzodiazépines sont contre-indiqués chez les patients aux antécédents de syndrome d'apnée obstructif du sommeil (SAOS). Préconiser un arrêt PROGRESSIF de la benzodiazépine.,(À TRAITER),0,0,0,0,1,1,0,0,0,0,0
Prazepam [LYSANXIA],Contrôle des contre-indications et précautions d'emploi :,Antécédent de myasthénie :,Attention ! Avec leur composante myorelaxante les benzodiazépines sont contre-indiqués chez les patients (notamment les personnes âgées) aux antécédents de myasthénie. Préconiser un arrêt PROGRESSIF de la benzodiazépine.,(À TRAITER),0,0,0,0,1,1,0,0,0,0,0
Prazepam [LYSANXIA],Contrôle des intéractions médicamenteuses :,Utilisation concomitante d’une autre benzodiazépine (anxio ou hypno) au même moment de la journée :,"Potentialisation des effets indésirables (troubles cognitifs,  syndrome confusionnel, troubles de la vigilance, chutes) sans augmentation de l’efficacité.",(À TRAITER),0,0,0,0,1,1,0,0,0,0,0
Prednisone / Prednisolone [CORTANCYL / SOLUPRED],,Traitement au long cours AVEC co-prescription vitamine D :,Prise en charge de [Instaurer la pathologie concerné par la corticothérapie]. Médicament hypokaliémiant (à surveiller). Médicament sujet à l'ostéoporose (Surveillance). À poursuivre.,(À TRAITER),0,1,0,0,0,0,1,0,0,0,0
Prednisone / Prednisolone [CORTANCYL / SOLUPRED],,Traitement au long cours SANS co-prescription vitamine D :,Prise en charge de [Instaurer la pathologie concerné par la corticothérapie]. Médicament hypokaliémiant (à surveiller). Médicament sujet à l'ostéoporose : préconiser une supplémentation en vitamine D (50 000 ou 80 000 selon IMC) avec une prise par mois (en précisant le jour exact) chez le sujet âgé afin d’éviter l’ostéoporose cortico-induite. À poursuivre.,(À TRAITER),0,1,0,0,0,0,1,0,0,0,0
Pregabaline [LYRICA],Contrôle des indications :,Sans antécédents :,Pas d’antécédent d’anxiété ou de douleurs neuropathiques dans le dossier médical. Médicament à l’origine de confusions et de désorientations de manière fréquente (entre 1 et 10% des patients) à prendre en compte chez la personne âgée. Médicament sujet à la dépendance (prévoir un arrêt progressif). Revoir l’indication.,(À TRAITER),0,0,0,0,1,0,0,0,0,0,0
